count,date,title,description,org_link,link
746,2024-02-13 11:28:00,[N-Stock] 오픈엣지테크놀로지 주가 20% 급등…3만원대 안착 여부 관건으로,"한편 오픈엣지테크놀로지는 <b>인공지능</b> 기술을 자율주행자동차, 보안카메라 등과 같은 엣지 환경에서 구현하기 위해 반드시 필요한 시스템반도체 설계 IP(Intellectual Property, 지적재산) 기술을 개발하는... ",https://www.cbci.co.kr/news/articleView.html?idxno=458685,https://www.cbci.co.kr/news/articleView.html?idxno=458685
747,2024-02-13 11:28:00,"현대카드, '아트 토크 위트 이안 쳉(Art Talk with Ian Cheng)' 프로그램 진행",미국 출신 작가 이안 쳉은 <b>인공지능</b>(AI)과 게임 엔진을 활용해 가상 생태계를 선보이는 뉴미디어 작업들로 국제 미술계의 주목을 받고 있다. 이번 프로그램에서는 작가가 지속해온 작업을 살펴보며 인간과... ,http://www.lkp.news/news/articleView.html?idxno=43780,http://www.lkp.news/news/articleView.html?idxno=43780
748,2024-02-13 11:28:00,"호주, AI 등 첨단 기술 도입 다른 국가에 뒤처져",호주가 AI 및 첨단 기술 도입이 다른 국가에 비해 뒤처지고 있다 [사진: 셔터스톡] 호주가 <b>인공지능</b>(AI) 및 첨단 기술 도입에서 다른 국가에 비해 뒤처지고 있는 나라로 꼽혔다. 지난 12일(현지시간) 블룸버그에 따르면... ,https://www.digitaltoday.co.kr/news/articleView.html?idxno=505667,https://www.digitaltoday.co.kr/news/articleView.html?idxno=505667
749,2024-02-13 11:28:00,"인천시, 인천자원순환가게 99개소로 확대 운영","시는 올해 시비 4억4000만원을 지원해 4개 구에 <b>인공지능</b>(AI) 기반의 무인회수기 22대를 설치해 식품 용기, 의류, 신발, 가방 등을 만들 수 있는 투명 페트병을 집중 수거할 계획이다. 김철수 시 환경국장은 “2026년... ",http://www.fnnews.com/news/202402131124156658,https://n.news.naver.com/mnews/article/014/0005141379?sid=102
750,2024-02-13 11:28:00,"올트먼, 반도체 판도 바꿀까…업계 &quot;기회 요인이나 더 두고봐야&quot;",자체 AI 반도체 조달 위해 최대 7조달러 규모 투자 유치 나서 삼성·SK 경영진과도 협력 논의…&quot;AI 시장 확대는 긍정적&quot; 장하나 김아람 기자 = 생성형 <b>인공지능</b>(AI) '챗GPT' 개발사 오픈AI의 최고경영자(CEO) 샘 올트먼이... ,https://www.yna.co.kr/view/AKR20240213070300003?input=1195m,https://n.news.naver.com/mnews/article/001/0014501986?sid=105
751,2024-02-13 11:28:00,"HBM 몸값 고공행진, 삼성·SK ‘진짜 대결’ 시작됐다",챗GPT 등장 이후 <b>인공지능</b>(AI) 열풍으로 대량의 데이터를 처리할 고성능 메모리 반도체를 찾는 곳이 많아지면서 HBM 주문량도 급증하고 있다. 그래픽처리장치(GPU)가 수행하는 연산의 양이 기하급수적으로 늘고 있는... ,http://news.heraldcorp.com/view.php?ud=20240213050345,https://n.news.naver.com/mnews/article/016/0002265782?sid=101
752,2024-02-13 11:28:00,"젠슨 황 엔비디아 CEO “각국, 독자적 AI인프라 구축해야”",<b>인공지능</b>(AI) 최첨단 반도체 시장을 주도하고 있는 엔비디아의 젠슨 황 최고경영책임자(CEO)가 반도체 성능 향상으로 AI 투자 비용이 점차 줄어들 것이라며 각국이 독자적인 AI 인프라를 구축해야 한다고 주장했다. 황... ,http://news.heraldcorp.com/view.php?ud=20240213050346,https://n.news.naver.com/mnews/article/016/0002265778?sid=104
753,2024-02-13 11:27:00,"하나은행, '일임형 ISA' 계좌에 AI 기술 도입…&quot;디지털 혁신 접목&quot;",이번 이벤트는 하나은행이 은행권 최초로 일임형 ISA 상품에 <b>인공지능</b>(AI) 기술을 도입한 것을 기념해 마련됐다. 하나은행은 하나금융융합기술원과 협력해 일임형 ISA 포트폴리오 구성에 AI 기술을 적용했다. 하나은행... ,https://www.news1.kr/articles/5318865,https://n.news.naver.com/mnews/article/421/0007347851?sid=101
754,2024-02-13 11:27:00,위기의 ROTC…필기시험 없앤다,"이와 함께 면접평가도 대면 면접 방식에서 <b>인공지능</b>(AI) 온라인 면접과 대면 면접을 혼합하는 방식으로 전환한다. AI면접에서는 확고한 윤리의식과 회복탄력성 등 9개 요소를 평가하며, 대면면접에서는 국가관과... ",http://www.wowtv.co.kr/NewsCenter/News/Read?articleId=A202402130125&t=NN,https://n.news.naver.com/mnews/article/215/0001148161?sid=102
755,2024-02-13 11:26:00,하나은행 &quot;일임형 ISA 가입하고 2만 하나머니 받으세요&quot;,"하나은행은 은행권 최초로 '일임형 ISA'에 <b>인공지능</b>(AI) 기술을 도입했다. 이를 기념해 마련된 이번 이벤트는 '일임형 ISA' 상품에 10만 원 이상 신규 가입하면 1년 이상 자동이체를 등록하거나, 이벤트 종료 시점 잔액이... ",https://www.etoday.co.kr/news/view/2330358,https://www.etoday.co.kr/news/view/2330358
756,2024-02-13 11:26:00,"日 닛케이, 다우존스 반등에 34년來 최고치 재경신",한편 반도체 설계 기업 Arm 홀딩스의 주가가 실적 발표 이후 <b>인공지능</b>(AI)에 대한 기대가 유지되며 30% 가까이 오른 가운데 대주주인 일본 소프트뱅크그룹 주가도 큰 폭 상승하고 있다. 외환 시장에서 엔화... ,https://news.einfomax.co.kr/news/articleView.html?idxno=4298285,https://news.einfomax.co.kr/news/articleView.html?idxno=4298285
757,2024-02-13 11:26:00,"KB금융, 지난해 4분기 관심도 '1위'…하나·우리금융 순",KB금융은 <b>인공지능</b>과 RPA를 활용해 금융거래 전반에서 이상 징후를 사전에 탐지하는 시스템을 구축하게 된다. 지난해 11월 모네타에는 KB금융이 중소기업 고객에게 우대 혜택을 제공하기 위해 'ONE KB 기업 패키지... ,http://www.ezyeconomy.com/news/articleView.html?idxno=130157,http://www.ezyeconomy.com/news/articleView.html?idxno=130157
758,2024-02-13 11:26:00,"구글, 유럽 대상 AI 교육 지원…300억원 상당 투자",유럽연합 AI 법 [사진: 셔터스톡] 구글이 유럽인의 <b>인공지능</b>(AI) 분야 교육을 지원하기 위해 2500만유로(약 357억원)의 지원 기금을 조성한다고 12일(현지시간) 블록체인 매체 코인텔레그래프가 전했다. '유럽을... ,https://www.digitaltoday.co.kr/news/articleView.html?idxno=505666,https://www.digitaltoday.co.kr/news/articleView.html?idxno=505666
759,2024-02-13 11:26:00,'민간 기상청' 케이웨더 공모주 청약 상장 후 20% 이상 영업이익률 낸다,이를 바탕으로 고객이 숨 쉬는 위치의 정확한 공기 데이터는 물론 고객이 생활하는 공간을 청정하게 관리해 주는 <b>인공지능</b>(AI) 환기 청정 솔루션을 제공한다. 이번에 케이웨더가 IPO를 진행하는 이유도 이 솔루션에... ,http://www.smedaily.co.kr/news/articleView.html?idxno=281476,http://www.smedaily.co.kr/news/articleView.html?idxno=281476
760,2024-02-13 11:26:00,이형석 광주 북구을 출마…&quot;민주주의 봄 되찾겠다&quot;,"이 의원은 북구 발전 공약으로 광주~송정 구간 운암선 도심철도 지하화, 개장 30년이 지나 낡은 패밀리랜드 최첨단 복합 테마파크 업그레이드, 아시아 캐릭터랜드 조성, <b>인공지능</b> 집적화단지 2단계 추진으로 'AI 중심도시... ",https://www.news1.kr/articles/5318903,https://n.news.naver.com/mnews/article/421/0007347845?sid=165
761,2024-02-13 11:26:00,"코엑스, 국내 첫 친환경 전시홀 개관",이동기 코엑스 사장은 “더플라츠 개관으로 <b>인공지능</b>(AI)이 주도하는 산업 트렌드 변화에 따른 혁신정보와 기술트렌드를 담은 신규 전시회 개최도 가능해졌다”고 기대했다. 구체적으로 프리미엄 친환경 마이스... ,http://news.heraldcorp.com/view.php?ud=20240213050335,https://n.news.naver.com/mnews/article/016/0002265770?sid=101
762,2024-02-13 11:26:00,스레드에 '핫 토픽'기능 도입 예정…어떤 기능일까?,아담 모세리 인스타그램 책임자는 &quot;트렌디한 주제는 스레드 내 사용자 참여에 기반한 <b>인공지능</b>(AI) 시스템에 의해 결정될 것&quot;이라고 말했다. 그러나 메타의 오늘의 핫 토픽 기능이 오로지 AI의 시스템에 따라 결정되는... ,https://www.digitaltoday.co.kr/news/articleView.html?idxno=505663,https://www.digitaltoday.co.kr/news/articleView.html?idxno=505663
763,2024-02-13 11:25:00,‘석유 블렌딩’ 규제 개선… 10대 교역국과 ‘통관혜택 공급망’ 완성,"특히 소관 1591개의 행정규칙 중 불합리하거나 불필요한 규제는 과감하게 정비하는 한편, 현장 업무에 <b>인공지능</b>(AI) 등 신기술을 적용하고 데이터 개방도 확대하는 등 업무방식을 디지털로 전환할 계획이다. 이를 통해... ",https://www.munhwa.com/news/view.html?no=2024021301032105292001,https://n.news.naver.com/mnews/article/021/0002620911?sid=101
764,2024-02-13 11:24:00,"[위클리오늘] 현대카드, 2월 문화 이벤트 진행···뉴미디어 작가 '이안 쳉'...",미국 출신 작가 이안 쳉은 <b>인공지능</b>(AI)과 게임 엔진을 활용해 가상 생태계를 선보이는 뉴미디어 작업들로 국제 미술계의 주목받고 있다. 이번 프로그램에서는 작가가 지속해온 작업을 살펴보며 인간과... ,http://www.weeklytoday.com/news/articleView.html?idxno=609621,http://www.weeklytoday.com/news/articleView.html?idxno=609621
765,2024-02-13 11:24:00,"웨인힐스브라이언트 A.I, 설비투자 통해 약 250억원 규모 인프라 구축","<b>인공지능</b> 스타트업 웨인힐스브라이언트 A.I(대표 이수민)가 웨인힐스 비전타워 신사옥에서 설비투자 및 연면적 520평 규모의 엔비디아 H100, 데이터 저장장치 서버, 스토리지, 24시간모니터링 시스템, 초광케이블... ",https://www.etnews.com/20240213000136,https://n.news.naver.com/mnews/article/030/0003180446?sid=101
766,2024-02-13 11:24:00,"최태원, 독일·스페인서 새 먹거리 구상 나선다","최 회장은 이번 MWC에서 <b>인공지능</b>(AI)이 촉발한 IT 현장을 직접 살필 예정이다. 최 회장은 최근 방한한 샘 올트먼 오픈AI 최고경영자(CEO)를 만나 향후 AI 반도체, AI 비서 플랫폼 등의 협력 방안을 논의했다. 아울러... ",http://www.edaily.co.kr/news/newspath.asp?newsid=02476406638790192,https://n.news.naver.com/mnews/article/018/0005672166?sid=101
767,2024-02-13 11:24:00,"가온칩스, 일본향 AI 반도체 설계 수주",가온칩스는 556억6300만원 상당의 AI(<b>인공지능</b>)용 주문형 반도체(ASIC) 설계 개발 계약을 따냈다고 13일 공시했다. 지난 2022년 매출의 128.49% 규모로 내년 말까지 개발을 완료키로 했다. 계약 당사자는 가온칩스의... ,https://www.smarttoday.co.kr/news/articleView.html?idxno=43555,https://www.smarttoday.co.kr/news/articleView.html?idxno=43555
768,2024-02-13 11:24:00,[주식 초고수는 지금] 류마티즘약 유럽 허가 신청에 셀트리온 순매수 1위,<b>인공지능</b>(AI) 반도체 수요가 급증하며 수혜 가능성이 커지면서 매수세가 몰린 것으로 보인다. 리노공업은 연구개발(R&amp;D)용 반도체 소켓 전문 기업으로 AI용 특화 반도체 수요가 폭증하면서 실적 증가폭이 높을... ,https://www.sedaily.com/NewsView/2D5CENR7VP,https://n.news.naver.com/mnews/article/011/0004298811?sid=101
769,2024-02-13 11:24:00,"SKT '엑스칼리버', 상반기 호주 동물병원 300곳서 활영",SKT 하민용 CDO와 에이티엑스 로저 데이비스(Roger Davis) 창업자 겸 디렉터가 유통 계약 체결 후 기념사진을 찍고 있다./SKT SK텔레콤의 AI(<b>인공지능</b>) 기반 수의 진단 보조 솔루션 '엑스칼리버(X Caliber)'가 호주 시장에... ,http://www.metroseoul.co.kr/article/20240213500195,http://www.metroseoul.co.kr/article/20240213500195
770,2024-02-13 11:23:00,[주린이의 공모주] 兆단위 대어 에이피알 등 4개사 출격,"지난 2022년 빅데이터 플랫폼을 활용한 <b>인공지능</b>(AI) 환기 청정기를 방송사, 건설사 등에 납품하며 7억원 이상의 영업이익을 기록했지만 작년 예상 누적 매출액은 142억원, 영업적자 19억원이 예상됩니다. 하지만... ",http://www.inews24.com/view/1686298,https://n.news.naver.com/mnews/article/031/0000812143?sid=101
771,2024-02-13 11:23:00,"최태원, 글로벌 경영 이어가…이번에는 유럽","최 회장은 MWC에서 챗GPT가 촉발한 생성형 <b>인공지능</b>(AI), 디지털 기술 경쟁 상황을 직접 살펴보고 SK의 ICT 분야 주요 경영진과 디지털 사업에 대한 논의도 진행할 것으로 보인다. SK텔레콤은 세계 유력 통신사들과 함께... ",https://www.busan.com/view/busan/view.php?code=2024021311202998373,https://n.news.naver.com/mnews/article/082/0001255321?sid=101
772,2024-02-13 11:22:00,"SKT 엑스칼리버, 상반기 호주 동물병원서 활용",SK텔레콤은 호주 최대 의료기기 유통기업인 에이티엑스(ATX Medical Solutions)와 <b>인공지능</b>(AI) 기반 수의 진단 보조 솔루션인 ‘엑스칼리버’의 호주 내 유통을 위한 상용 계약을 체결했다고 13일 밝혔다. 지난해 11월... ,http://news.heraldcorp.com/view.php?ud=20240213050315,https://n.news.naver.com/mnews/article/016/0002265754?sid=105
773,2024-02-13 11:22:00,"천안시, 차세대 지방 세입정보시스템 개통","이 시스템은 정부•지자체가 연계된 통합 클라우드로 구축됐고, 전국 데이터 기반의 빅데이터 분석과 <b>인공지능</b>(AI) 기반 첨단 예측•분석 서비스 제공 등 다양한 신기술을 접목한 <b>지능</b>형 세입정보 시스템을 제공하게... ",http://www.chungnamilbo.co.kr/news/articleView.html?idxno=756606,http://www.chungnamilbo.co.kr/news/articleView.html?idxno=756606
774,2024-02-13 11:22:00,"대전기상청, 빅데이터 기반 ‘충남날씨관광’ 서비스 시작","기상기후 및 관광 빅데이터를 활용하는 이 서비스는 여행 유형에 따라 <b>인공지능</b>(AI)과 해시태그 등 두 가지 방법으로 충남의 관광지를 추천해 준다. 일례로 여행 날짜와 동반유형, 교통편, 테마를 선택하면 충남지역 관광지... ",https://www.kmib.co.kr/article/view.asp?arcid=0019158378&code=61121111&cp=nv,https://n.news.naver.com/mnews/article/005/0001673584?sid=102
775,2024-02-13 11:22:00,"천안시, 시청 민원실에 <b>인공지능</b> 방역로봇 설치",천안시청 민원실에 설치된 <b>인공지능</b>(AI) 방역로봇. (사진제공=천안시) 충남 천안시가 방문 민원인의 안전과 쾌적한 민원실 환경 조성을 위해 시청 민원실에 <b>인공지능</b>(AI) 방역로봇을 설치했다고 13일 밝혔다. <b>인공지능</b>(AI)... ,http://www.chungnamilbo.co.kr/news/articleView.html?idxno=756609,http://www.chungnamilbo.co.kr/news/articleView.html?idxno=756609
776,2024-02-13 11:22:00,"관세행정 스마트 혁신나선다…사회안전, 국가번영, 글로벌 무역 스탠다드 선도",인프라에 있어서는 <b>인공지능</b>(AI) 우범화물 선별모델을 확대(수입ㆍ여행자+특송화물)하고 X-레이 판독시스템을 고도화한다. 우범여행자추적 AI CCTV 구축 등 신기술 기반 감시 인프라도 강화한다. 둘째로... ,https://www.dnews.co.kr/uhtml/view.jsp?idxno=202402130917532610534,https://www.dnews.co.kr/uhtml/view.jsp?idxno=202402130917532610534
777,2024-02-13 11:22:00,"LG 올레드 TV, 영화 감상을 위한 최고의 선택 '호평'",<b>인공지능</b> 음향 기술은 2채널 음원을 이제 가상의 11.1.2채널까지 변환해 풍성한 음향을 구현한다. 영국 테크레이더는 LG 올레드 에보(G3)를 '최고 영화 감상용 TV'에 선정하며 &quot;영화를 감상하는데 환상적이다&quot;고 극찬했다.... ,http://www.iminju.net/news/articleView.html?idxno=97618,http://www.iminju.net/news/articleView.html?idxno=97618
778,2024-02-13 11:20:00,[2024 관세청 업무계획] 촘촘한 마약 단속망 구축…글로벌 중추 국가 표준 선...,<b>인공지능</b>(AI)기반 우범선별모댈을 일반화물에서 특송화물분야까지 확대하고 적발결과 학습을 통해 AI선별의 적중률을 향상시킨다는 계획이다.  관세청은 Customs Lab 1.0을 330억원 내외로 개발해 우범여행자 추적 CCTV... ,https://www.tfmedia.co.kr/news/article.html?no=158322,https://www.tfmedia.co.kr/news/article.html?no=158322
779,2024-02-13 11:20:00,현대카드 &quot;뉴미디어 작가 ‘이안 쳉’ 아트 토크부터 ‘펑크’ 음반 감상까지...,미국 출신 작가 이안 쳉은 <b>인공지능</b>(AI)과 게임 엔진을 활용해 가상 생태계를 선보이는 뉴미디어 작업들로 국제 미술계의 주목을 받고 있다. 이번 프로그램에서는 작가가 지속해온 작업을 살펴보며 인간과... ,https://vop.co.kr/A00001647592.html,https://vop.co.kr/A00001647592.html
780,2024-02-13 11:20:00,"웨인힐스브라이언트 A.I, 설비투자 통해 약 250억원 규모 인프라 구축","<b>인공지능</b> 스타트업 웨인힐스브라이언트 A.I(대표 이수민)가 웨인힐스 비전타워 신사옥에서 설비투자 및 연면적 520평 규모의 엔비디아 H100, 데이터 저장장치 서버, 스토리지, 24시간모니터링 시스템, 초광케이블... ",https://www.epnc.co.kr/news/articleView.html?idxno=240660,https://www.epnc.co.kr/news/articleView.html?idxno=240660
781,2024-02-13 11:20:00,"최태원,'글로벌스토리' 가속도…&quot;다음 공략지는 유럽&quot;","최 회장은 이번 MWC에서 챗GPT가 촉발한 생성형 <b>인공지능</b>(AI), 디지털 기술경쟁 상황을 직접 살펴보며 인사이트를 얻고, SK ICT 분야 주요경영진과 디지털 사업에 대한 논의도 진행할 것으로 예상된다. 지난해 7월... ",http://www.seouleconews.com/news/articleView.html?idxno=76074,http://www.seouleconews.com/news/articleView.html?idxno=76074
782,2024-02-13 11:20:00,AI가 우범여행자 추적하고 수입신고서 심사,"택스워치 강지선 기자 zsun11@taxwatch.co.kr 관세청, 2024년 업무계획 발표 품목분류 추천에 생성형AI 활용 관세청이 올해 우범자 추적, 수입신고서 심사 등 업무에 <b>인공지능</b>(AI) 기술을 활용한다. AI를 통해 감시단속을... ",https://www.taxwatch.co.kr/article/tax/2024/02/13/0002/naver,https://www.taxwatch.co.kr/article/tax/2024/02/13/0002/naver
783,2024-02-13 11:19:00,"독일 찍고 스페인으로...최태원 회장, 유럽경영 행보 잇는다",최 회장은 MWC에서 챗GPT가 촉발한 생성형 <b>인공지능</b>(AI)과 디지털 기술 전환 등을 직접 살펴보며 인사이트를 얻고 그룹 ICT 분야 주요 경영진과 사업에 대한 논의도 진행할 것으로 예상된다. 최 회장은 앞서 지난달 미국... ,http://news.heraldcorp.com/view.php?ud=20240213050307,https://n.news.naver.com/mnews/article/016/0002265742?sid=101
784,2024-02-13 11:18:00,"LGU+ 스포키, 핸드볼 리그 생중계 시작",한편 LG유플러스는 자체 개발한 <b>인공지능</b>(AI) 기술 등을 활용해 스포키 고도화를 추진할 방침이다. 앞서 스포키는 익시 기반의 비전 AI 기술을 활용해 스포츠 경기 하이라이트 영상을 실시간으로 제작해 보여주는 AI... ,http://www.metroseoul.co.kr/article/20240213500186,http://www.metroseoul.co.kr/article/20240213500186
785,2024-02-13 11:18:00,"김용경 대전 서구갑 예비후보, <b>인공지능</b> 활용한 선거운동 비법 공개",사진=선거캠프 제공  김용경 국민의힘 대전 서구갑 국회의원 예비후보가 12일 <b>인공지능</b>(AI)를 활용한 선거운동 비법(秘法)을 공개하며 오는 16일 국민의힘 공천후보자 면접을 준비하는 것으로 알려졌다. 김용경... ,https://daily.hankooki.com/news/articleView.html?idxno=1050985,https://daily.hankooki.com/news/articleView.html?idxno=1050985
786,2024-02-13 11:18:00,최태원 ‘현장 경영’ 유럽 시장 종횡무진 누빈다,SK텔레콤은 작년 7월 세계 유력 통신사들과 함께 각사 역량을 합쳐 공통의 <b>인공지능</b>(AI) 플랫폼을 만들기 위한 '글로벌 텔코 AI 얼라이언스'를 결성했다. 최 회장은 당시 온라인으로 진행된 업무협약(MOU) 체결식에... ,https://www.ekn.kr/web/view.php?key=20240213023086909,https://www.ekn.kr/web/view.php?key=20240213023086909
787,2024-02-13 11:18:00,"백화점 4사, 포스트 설 마케팅 돌입","롯데백화점은 <b>인공지능</b>을 활용한 올해 봄 시즌 비주얼 이미지를 공개했다. 롯데백화점은 내달 28일까지 '원더 드림스(WONDER DREAMS), 도심 한복판에서 발견한 봄'이라는 테마로 백화점 내ᆞ외부를 시즌 비주얼로 연출한다.... ",http://www.finomy.com/news/articleView.html?idxno=206902,http://www.finomy.com/news/articleView.html?idxno=206902
788,2024-02-13 11:18:00,크래프톤 &quot;AI 분야 R&amp;D 투자 증대&quot;,크래프톤 연간 및 4분기 실적 (사진=크래프톤) 특히 중장기 계획으로 ▲배틀그라운드 IP의 프랜차이즈화 ▲인도 시장에서의 성장 및 독립적인 퍼블리싱 확대 ▲<b>인공지능</b>(AI) 딥러닝 분야 연구개발(R&amp;D) 투자 증대를... ,https://www.aitimes.com/news/articleView.html?idxno=157116,https://www.aitimes.com/news/articleView.html?idxno=157116
789,2024-02-13 11:17:00,'골든글러브 3관왕' 성난 사람들 감독이 극찬한 TV는?,"한편, 2024년형 LG OLED 에보는 알파11 프로세서를 4배 강력해진 <b>인공지능</b>(AI) 성능을 기반으로 그래픽 성능과 프로세싱 속도가 각각 70%, 30% 향상됐다. 새로운 AI 업스케일링은 영상을 픽셀 단위로 분석하고 흐릿한... ",http://www.fnnews.com/news/202402131013016014,https://n.news.naver.com/mnews/article/014/0005141366?sid=101
790,2024-02-13 11:17:00,&quot;AI 잘 쓰려면 사내 데이터 다 엎어야 해요&quot;,[편집자주] “AI 잘 쓰려면 사내 데이터 다 엎어야 해요&quot; 이진형 데이터마케팅코리아 대표는 인터뷰 중간에 “<b>인공지능</b>(AI)이 주 1일 근무체제를 만들 수도 있다”고 말했다. 기업에 생성AI를 도입하고 일하는 방식을... ,https://zdnet.co.kr/view/?no=20240213100648,https://n.news.naver.com/mnews/article/092/0002321106?sid=105
791,2024-02-13 11:16:00,&quot;핸드볼 리그 생중계로 스포츠 팬 경험 혁신&quot;,LG유플러스는 자체 개발한 AI(<b>인공지능</b>) 기술 등을 활용해 스포키 고도화도 추진할 방침이다. 앞서 스포키는 익시(ixi) 기반의 비전 AI 기술을 활용해 스포츠 경기 하이라이트 영상을 실시간으로 제작해 보여주는 'AI... ,http://www.4th.kr/news/articleView.html?idxno=2057271,http://www.4th.kr/news/articleView.html?idxno=2057271
792,2024-02-13 11:16:00,'AI 기술'로 더 똑똑해진 하나은행 ISA,"하나은행이 '일임형 ISA(개인종합자산관리계좌)'에 AI(<b>인공지능</b>) 기술을 더했다. 이를 기념한 신규 가입 이벤트도 다음달 29일까지 진행할 예정이다. '만능통장'이란 별칭을 가진 ISA는 하나의 계좌로 예·적금, 펀드 등... ",https://www.kbanker.co.kr/news/articleView.html?idxno=213004,https://www.kbanker.co.kr/news/articleView.html?idxno=213004
793,2024-02-13 11:16:00,"현대카드, &quot;뉴미디어 작가 이안 쳉 작품과 펑크 음반을 만나보세요&quot;",미국 출신 작가 이안 쳉은 <b>인공지능</b>(AI)과 게임 엔진을 활용해 가상 생태계를 선보이는 뉴미디어 작업으로 국제 미술계의 주목을 받고 있다. 프로그램 참여 고객은 이안 쳉 작가가 지속해온 작업을 살펴보며 인간과... ,http://www.bizwnews.com/news/articleView.html?idxno=76596,http://www.bizwnews.com/news/articleView.html?idxno=76596
794,2024-02-13 11:16:00,달리는 美 증시…6년 전 '볼마게돈' 다시 올 수도?,"생성형 <b>인공지능</b>(AI)의 최대 수혜주인 엔비디아의 경우 향후 12개월 예상 수익의 33.48배에 거래되고 있다. 엔비디아는 지난해 주가가 3배 이상으로 폭등했고, 올해에도 다시 46% 올랐다. 엔비디아 주가는 지난해... ",http://www.wowtv.co.kr/NewsCenter/News/Read?articleId=A202402130121&t=NN,https://n.news.naver.com/mnews/article/215/0001148160?sid=101
795,2024-02-13 11:15:00,"관세청, 마약 청정국 지위 회복 위해… 태국·베트남 등 여행자 검사 확대",<b>인공지능</b>(AI) 기반의 선별 모델을 특송화물로까지 확대해 감시 단속을 강화한다. 국가탐지견센터와 엑스레이(X-ray) 보안판독센터 등을 설치해 탐지견을 양성하고 부처·공공기관을 대상으로 엑스레이 교육을 제공한다.... ,https://biz.chosun.com/policy/policy_sub/2024/02/13/APTSUWGKDRGQRE26FHT423DY2A/?utm_source=naver&utm_medium=original&utm_campaign=biz,https://n.news.naver.com/mnews/article/366/0000969975?sid=101
