count,date,title,description,org_link,link
250,2024-02-13 15:03:00,“이것 제공하는 회사 가고싶어요”…‘코로나 학번’ 졸업생에 물어보니,2024년 졸업생은 생성형 <b>인공지능</b>에 대해 누구보다 잘 알고 있다. 특히 챗GPT와 달리(DALL-E)와 같은 도구에 대해 익숙하다. 올해 졸업생 중 85%가 생성형 AI 도구에 대해 들어봤다고 응답했다. 이는 2023년 졸업생(61%)보다... ,https://www.mk.co.kr/article/10941576,https://n.news.naver.com/mnews/article/009/0005257777?sid=102
251,2024-02-13 15:02:00,글로벌 R＆D 허브 조성에 1조8천억원 투입…3만원대 5G 요금제 출시도 본격,양자·<b>인공지능</b>(AI)·첨단바이오 등 3대 기술 분야의 성과 창출을 본격화하고 통신비 절감을 위해 3만원에 5세대(5G) 요금제 도입에도 속도를 낸다. 과학기술정보통신부는 13일 이같은 내용을 골자로 한 ‘2024년... ,http://news.heraldcorp.com/view.php?ud=20240213050482,https://n.news.naver.com/mnews/article/016/0002265896?sid=105
252,2024-02-13 15:02:00,"과기정통부, 통신 과점체계 개선 등 올해 4대 추진전략 발표","과학기술정보통신부는 이날 2024년 대한민국이 과학기술 강국·디지털 모범국가로 도약할 수 있도록 4대 추진전략(세계 최고 연구개발(R&amp;D) 허브 대한민국 조성, 도전적 R&amp;D로 혁신 견인, <b>인공지능</b>(AI)·디지털 대전환 선도... ",https://it.chosun.com/news/articleView.html?idxno=2023092110135,https://it.chosun.com/news/articleView.html?idxno=2023092110135
253,2024-02-13 15:02:00,"KAI, 지난해 역대 최대 매출 달성…미래사업 본격 투자","KAI는 이번 투자를 통해 무인전투기 개발을 위한 개념연구과 자율비행 실증, <b>인공지능</b>(AI) 파일럿 편대운용 제어 및 고성능 데이터링크 통합 기술 등 유무인 복합체계의 기술을 확보한다는 계획이다. 향후 KF-21과... ",https://www.mediapen.com/news/view/896559,https://www.mediapen.com/news/view/896559
254,2024-02-13 15:02:00,정부 단통법 폐지시 “지원금 공시는 폐지·25% 선택약정할인 유지”,"과기정통부는 범부처 <b>인공지능</b>(AI)·디지털 정책을 종합·재설계해 '대한민국 디지털 전략 2.0'을 추진한다. 교육·의료·법률 등 경제·산업 전반에 AI를 적용하는 AI일상화에 7737억원을 투입하고, 규제혁신을 통해 생산성... ",https://www.etnews.com/20240213000174,https://n.news.naver.com/mnews/article/030/0003180561?sid=105
255,2024-02-13 15:02:00,"과기정통부, 상반기 '대한민국 디지털 전략 2.0' 수립...AI일상화 추진","또 국산 <b>인공지능</b>(AI) 반도체 기반의 '온디바이스 AI 활성화 전략'을 추진하고 AI일상화 프로젝트 등 국민생활 속 AI 활용 확산에 나선다. 아울러 3대 게임체인저 기술(양자, AI, 첨단바이오)의 성과 창출을 본격화한다는... ",https://www.digitaltoday.co.kr/news/articleView.html?idxno=505627,https://www.digitaltoday.co.kr/news/articleView.html?idxno=505627
256,2024-02-13 15:02:00,AI 공존시대 연다…신뢰성 검·인증제도 활성화 추진,"뉴스토마토 = 이지은 기자 | 과학기술정보통신부가 2024년 <b>인공지능</b>(AI) 공존시대를 만들기 위해 글로벌 규범 선도에 나섭니다. 특히 안전하고, 신뢰할 수 있는 AI 질서 안착을 위해 <b>인공지능</b>기본법 제정, AI안전연구소... ",http://www.newstomato.com/ReadNews.aspx?no=1219473&inflow=N,http://www.newstomato.com/ReadNews.aspx?no=1219473&inflow=N
257,2024-02-13 15:02:00,"[2024 업무보고] 과기정통부, 대한민국 디지털2.0 전략 수립, AI·글로벌R&amp;D ...",과학기술정보통신부는 2024년이 <b>인공지능</b>(AI) 공존사회로 진입했다는 판단이다. 그동안 AI·디지털기술 활성화 기반을 조성하는데 주력했다면 올해에는 대한민국 디지털전략 2.0 등을 통해 AI·디지털 기술을 국민 생활에... ,https://www.etnews.com/20240213000245,https://n.news.naver.com/mnews/article/030/0003180562?sid=105
258,2024-02-13 15:02:00,"KT, 글로벌 AI 콘퍼런스 'Remarkable 2024' 참가","사진=KT 제공 매일일보 = 이태민 기자  |  KT는 글로벌 <b>인공지능</b>(AI) 연구 기관 '캐나다 벡터 연구소'가 주최한 AI 콘퍼런스 'Remarkable 2024'에 참가했다고 13일 밝혔다. Remarkable 2024는 석학, 산업 종사자, 스타트업, 정부... ",http://www.m-i.kr/news/articleView.html?idxno=1092685,http://www.m-i.kr/news/articleView.html?idxno=1092685
259,2024-02-13 15:02:00,[자막뉴스] 전국 최초 획기적 시스템...AI가 찾아낸 '도로 위 지뢰',[백승철 / 정보통신업체 부장 : <b>인공지능</b>으로 자동으로 탐색하고 데이터베이스에서 도로 관리부서의 업무 효율성을 도와주고 있습니다.] 화성시는 지난해 버스와 택시에 단말기 70개를 부착한 뒤 AI 기반 반복 학습을 통해... ,https://www.ytn.co.kr/_ln/0134_202402131502300030,https://n.news.naver.com/mnews/article/052/0001997271?sid=102
260,2024-02-13 15:02:00,"KAI, 작년 역대 최고 매출 기록…올해 차세대공중전투체계 등 미래사업 집중 ...","KAI는 이번 투자를 통해 무인전투기 개발을 위한 개념연구와 자율비행 실증, <b>인공지능</b> 조종사(AI Pilot) 편대운용 제어 및 고성능 데이터링크 통합 기술 등 유무인 복합체계의 기술을 확보한다는 계획이다. KAI는... ",https://www.viva100.com/main/view.php?key=20240213010003477,https://www.viva100.com/main/view.php?key=20240213010003477
261,2024-02-13 15:01:00,[2024 ICT 정책분석] SW 해외수출 지원…공공사업 선진화 박차,"먼저, <b>인공지능</b>(AI) 및 디지털 글로벌 주도권 확보 측면에서 국내 서비스형소프트웨어(SaaS) 기업들의 글로벌 시장 진출 확대를 지원한다. 이들 기업의 글로벌 시장 진입→마케팅→안착에 이르기까지 단계별 종합... ",https://www.ddaily.co.kr/page/view/2024021310363771157,https://n.news.naver.com/mnews/article/138/0002166717?sid=105
262,2024-02-13 15:01:00,[2024 ICT 정책분석] 일상이 된 AI…“범부처 AI‧디지털 정책 재설계”,"정부가 <b>인공지능</b>(AI) 경쟁력 확보에 올인했다. 범부처 AI‧디지털 정책을 종합‧재설계하는 ‘대한민국 디지털 전략 2.0’을 추진한다는 계획이다. AI가 기술 혁신을 넘어 산업과 경제, 국민 일상 등 모든 분야에... ",https://www.ddaily.co.kr/page/view/2024021311350117724,https://n.news.naver.com/mnews/article/138/0002166718?sid=105
263,2024-02-13 15:01:00,연내 양자 통신 전송거리 1000배로...과기의전원 신설 추진,"양자, <b>인공지능</b>(AI), 첨단바이오를 3대 게임체인저 기술로 지목하고 올해부터 본격적인 성과 창출에 나선다. 올해 하반기까지 양자 유선통신 전송 거리를 현재의 1000배 수준인 100㎞로 늘리고 20큐비트급( 양자컴퓨터를... ",https://biz.chosun.com/science-chosun/science/2024/02/13/VKKCCUEHVRFPTNZL3FAAT7LAKQ/?utm_source=naver&utm_medium=original&utm_campaign=biz,https://n.news.naver.com/mnews/article/366/0000970032?sid=105
264,2024-02-13 15:01:00,과기부 &quot;글로벌 R&amp;D 투자 1.8조로 확대…3만원대 5G 요금제 신설&quot;,"AI(<b>인공지능</b>) 분야에서는 생성형 AI의 한계(거짓답변·편향 등) 극복을 위한 차세대 기술개발(580억원)을 추진하고, 해외 유수 연구진과 함께 고난도 연구를 수행하는 'AI 연구거점'을 국내와 미국에 올해 하반기 90억원... ",https://biz.sbs.co.kr/article_hub/20000156720?division=NAVER,https://n.news.naver.com/mnews/article/374/0000370275?sid=101
265,2024-02-13 15:01:00,"[2024 ICT 정책분석] 과기정통부, 12대 핵심과제로 R&amp;D 강화·AI 주도권 확보...",지난해까지의 ICT 분야 정책을 바탕으로 올해는 ▲세계 최고 연구·개발(R&amp;D) 허브 조성 ▲도전적 R&amp;D를 통한 혁신 견인 ▲<b>인공지능</b>(AI)·디지털 대전환(DX) 선도 ▲국민과 함께 하는 따뜻한 AI·디지털 등 4대 추진 전략을... ,https://www.ddaily.co.kr/page/view/2024021313594494022,https://n.news.naver.com/mnews/article/138/0002166720?sid=105
266,2024-02-13 15:01:00,정부 &quot;AI로 일자리 창출하겠다…AI기본법 제정·AI안전연구소 신설&quot;,"정부가 올해 글로벌 연구개발(R&amp;D) 중심으로 연구 혁신 기틀을 마련하는 한편, <b>인공지능</b>(AI) 기반 경제성장과 일자리 창출 확산에 적극 나선다. 이를 위해 <b>인공지능</b>법, AI 안정연구소 등을 추진할 방침이다.... ",http://www.inews24.com/view/1686432,https://n.news.naver.com/mnews/article/031/0000812243?sid=105
267,2024-02-13 15:01:00,올해 과기의전원 만들고 100㎞ 양자인터넷 시연한다,"과기정통부는 글로벌 연구개발(R&amp;D)을 지원하는 ‘세계 최고 R&amp;D 허브 대한민국 조성’, 양자·<b>인공지능</b>(AI)·바이오 등 첨단 기술을 선점하는 ‘도전적 R&amp;D로 혁신 견인’, AI를 포함한 ICT 신기술 확보를 위한 ‘AI·디지털... ",https://www.sedaily.com/NewsView/2D5CF889S7,https://n.news.naver.com/mnews/article/011/0004298932?sid=105
268,2024-02-13 15:01:00,과기정통부 “올해 국제 공동 연구 강화…교육·의료 AI 활용에 7700억원 투입...,"양자와 <b>인공지능</b>(AI), 첨단 바이오 분야에서 본격적인 성과를 내기 위한 사업에 나서고, 특히 AI를 의료나 교육 등 일상에서 쓸 수 있도록 하는 기술 개발에는 약 7700억원을 쓴다. 또 40만~80만원대 단말기 출시도... ",https://www.khan.co.kr/science/science-general/article/202402131500001,https://n.news.naver.com/mnews/article/032/0003278667?sid=105
269,2024-02-13 15:01:00,"[2024 ICT 정책분석] 'AI 정보보호' 본격화, 통합분석시스템·디지털안전법 출...",정부가 '<b>인공지능</b>(AI) 보안'에 초점을 둔 사이버 위협 대응 정책을 추진한다. AI 기술을 기반으로 새로운 대응 시스템을 구축해 'AI 정보보호' 대응 체계를 강화한다는 구상이다. 13일 과학기술정보통신부(이하 과기정통부)... ,https://www.ddaily.co.kr/page/view/2024021310574014331,https://n.news.naver.com/mnews/article/138/0002166719?sid=105
270,2024-02-13 15:01:00,"관세청, 마약청정국 지위회복 두 팔 걷었다",고 청장은 &quot;지난해 10월 발족한 '스마트혁신추진단'을 중심으로 국민 눈높이에 불합리하거나 불필요한 규제를 전면 혁신해 경제 활동의 자유를 확대할 것&quot;이라면서 &quot;<b>인공지능</b>과 빅데이터 등 신기술을 활용해 관세행정의... ,http://www.fnnews.com/news/202402130854095338,https://n.news.naver.com/mnews/article/014/0005141485?sid=102
271,2024-02-13 15:01:00,과기정통부 &quot;단통법 폐지…국민 생활 속 AI에 7700억 투입&quot;,정부가 <b>인공지능</b>(AI) 기술로 국민 생활에 혁신을 가속화하는 데 약 7700억원을 투입한다. 가계 통신비를 낮추기 위해 단말기 유통구조 개선에 관한 법률(단말기유통법)을 폐지하는 한편 3만원대 5G 요금제를 신설한다.... ,https://view.asiae.co.kr/article/2024021310524888976,https://n.news.naver.com/mnews/article/277/0005379162?sid=105
272,2024-02-13 15:01:00,과기정통부 “교육‧의료‧법률 분야 AI 확산에 7700억 투입”,과학기술정보통신부가 올해 교육‧의료‧법률 등의 분야 AI(<b>인공지능</b>) 확산 추진에 약 7700억원을 투입한다는 계획을 밝혔다. 지난해 발표한 디지털 권리장전을 기반으로 AI 안전과 신뢰성을 확보하기 위한... ,https://biz.chosun.com/it-science/ict/2024/02/13/75JEXUGCRJH2LMK6RMVQVH6LUQ/?utm_source=naver&utm_medium=original&utm_campaign=biz,https://n.news.naver.com/mnews/article/366/0000970031?sid=105
273,2024-02-13 15:01:00,&quot;AI 기반 경제·산업 대도약···글로벌 디지털 질서 주도&quot;,"과기정통부가 <b>인공지능</b>(AI)과 디지털 분야 재설계로 글로벌 기술혁신을 선도하는 한편 전(全)산업과 국민생활 전반에 AI를 확산, 생산성 혁명과 일자리 창출, 국민 삶의 질을 획기적으로 높이겠다고 13일 밝혔다. 이날... ",https://zdnet.co.kr/view/?no=20240213143713,https://n.news.naver.com/mnews/article/092/0002321140?sid=105
274,2024-02-13 15:00:00,3만원대 5G 요금제 활성화 &quot;통신비 부담 경감&quot;,정보통신기술(ICT) 정책은 <b>인공지능</b>(AI)을 중심으로 펼쳐진다. 최근 부상하고 있는 온디바이스 AI 시장 선점을 돕는 '온디바이스 AI 활성화 전략'이 마련된다. 온디바이스 AI는 온라인 접속에 의존하지 않고 기기 단말... ,https://www.news1.kr/articles/5318989,https://n.news.naver.com/mnews/article/421/0007348477?sid=105
275,2024-02-13 15:00:00,난 영화 안 보고 OTT·유튜브 본다… 올 설 연휴 극장가 찬바람,최근에는 수십여분 분량의 영상을 보지 않고 <b>인공지능</b>(AI)를 활용해 줄글로 요약해 핵심만 파악할 수 있다. 이같은 배경에는 일상적 바쁨과 경쟁이 일상화된 ‘분초사회’(분초를 다투며 시간을 효율적으로 쓰려는... ,http://www.segye.com/newsView/20240213509953?OutUrl=naver,https://n.news.naver.com/mnews/article/022/0003903796?sid=103
276,2024-02-13 15:00:00,"청송군 치매안심센터, ‘AI 스마트 돌봄서비스 확대’ 운영",청송군치매안심센터는 <b>인공지능</b>(AI)을 활용한 치매 돌봄 지원사업을 올 2월부터 30가구로 사업을 확대하여 운영한다. 군은 지난해 하반기부터 재가 치매환자 10가구를 대상으로 <b>인공지능</b>(AI) 스피커 무료 대여사업을 시범... ,https://www.nspna.com/news/?mode=view&newsid=682401,https://www.nspna.com/news/?mode=view&newsid=682401
277,2024-02-13 15:00:00,"내달 '3만원대 5G 요금제' 신설, AI통한 산업·일상 고도화 추진",이날 이 장관은 △세계 최고 R&amp;D(연구개발) 허브 조성 △도전적 R&amp;D로 혁신 견인 △<b>인공지능</b>·디지털 대전환 선도 △국민과 함께하는 따뜻한 AI·디지털 등 4대 추진전략과 함께 12개 핵심 과제를 본격 추진한다고 말했다.... ,http://news.mt.co.kr/mtview.php?no=2024021311322951598,https://n.news.naver.com/mnews/article/008/0004997959?sid=105
278,2024-02-13 15:00:00,"정부, 온디바이스 AI활성화 전략 내놓는다",정부가 <b>인공지능</b>(AI)·디지털 관련 범부처 정책을 종합 재설계 한다. 경제성장을 견인할 AI·디지털 신산업과 서비스를 발굴하고 생활 필수 서비스에의 도입을 추진하는 것이다. 이를 위해 국산 AI 반도체를 기반으로... ,http://www.newsis.com/view/?id=NISX20240213_0002624553&cID=13005&pID=13100,https://n.news.naver.com/mnews/article/003/0012370401?sid=105
279,2024-02-13 15:00:00,"코아스템켐온, 바오밥에이바이오와 AI신약개발 위한 비임상 인프라 협력","코아스템켐온(166480)은 <b>인공지능</b>(AI) 기반 신약개발 및 CryoEM(저온전자현미경, Cryo-element Microscopy) 전문기업인 바오밥에이바이오와 글로벌 경쟁력 강화를 위한 전략적 파트너십을 체결했다고 13일 밝혔다.... ",http://www.edaily.co.kr/news/newspath.asp?newsid=02889686638790192,https://n.news.naver.com/mnews/article/018/0005672316?sid=105
280,2024-02-13 15:00:00,과기정통부 &quot;글로벌 R&amp;D 확대…AI·디지털 혁신으로 대도약&quot;,"4대 추진전략·12대 핵심과제 발표 강건택 조승한 기자 = 정부가 올해 해외 협력 연구개발(R&amp;D)을 대폭 늘리고 양자, <b>인공지능</b>(AI), 첨단바이오 분야 연구 성과를 내겠다는 계획을 밝혔다. AI와 디지털 혁신을 통해 경제... ",https://www.yna.co.kr/view/AKR20240213065800017?input=1195m,https://n.news.naver.com/mnews/article/001/0014502414?sid=105
281,2024-02-13 15:00:00,글로벌 연구예산 3배 이상 확대 &quot;양자·AI·바이오 성과&quot;,"과학기술정보통신부가 2024년 양자, <b>인공지능</b>(AI), 첨단 바이오 분야에 주력한다. 또 지난해부터 강조한 글로벌 연구·개발(R&amp;D) 협력 사업도 본격적으로 추진한다. 과기정통부는 2024년 주요 정책 추진 계획을 13일... ",https://www.news1.kr/articles/5318940,https://n.news.naver.com/mnews/article/421/0007348476?sid=105
282,2024-02-13 14:59:00,"다쏘시스템, '3D익스피리언스 월드 2024' 개최","다양한 패널 발표, 기술과 교육 세션, 네트워킹을 통해 <b>인공지능</b>(AI)과 디지털 트랜스포메이션부터 협업 혁신, 버추얼 트윈 등 최신 주제를 공유하고 전략을 논의할 예정이다. 솔리드웍스와 3D익스피리언스 웍스는 세계... ",https://www.etnews.com/20240213000249,https://n.news.naver.com/mnews/article/030/0003180557?sid=105
283,2024-02-13 14:59:00,"국립부산과학관, AI 캠프 등 과학교육 풍성","실험탐구교실, <b>인공지능</b>교실, SW코딩교실 등 교과와 연계된 주제에 실험 위주의 교육으로 구성하며 에코사이언스와 자율탐구 프로젝트 등 최신 이슈를 주제로 심화학습도 할 수 있어 과학적 상상력과 자기주도적 문제... ",https://www.moneys.co.kr/article/2024021310520782133,https://n.news.naver.com/mnews/article/417/0000981319?sid=102
284,2024-02-13 14:58:00,충북대 신소재공학과 김한슬 교수 다중이온 전도 반도체 신소재 기반 장/단기...,"있는 <b>인공지능</b>용 시냅스 소자를 개발했다고 13일 밝혔다. 이 연구는 김한슬 교수, 최진우 교수, 송명관 박사가 교신저자로 참여했고 한양대 이다슬 박사, 한국광기술원 이승제 박사, 한국재료연구원 김재호... ",http://www.veritas-a.com/news/articleView.html?idxno=493842,http://www.veritas-a.com/news/articleView.html?idxno=493842
285,2024-02-13 14:58:00,"국립군산대 <b>인공지능</b>융합전공, 독일 명문 아헨공대와 진로탐색학점제 프로그램...",국립군산대학교 G-SEED 진로탐색학점제 프로그램으로 컴퓨터소프트웨어학부 <b>인공지능</b>융합전공 학생들이 독일 대학과 연구소를 방문했다고 13일 밝혔다.  국립군산대학교 G-SEED 진로탐색학점제 프로그램으로... ,https://www.pointdaily.co.kr/news/articleView.html?idxno=190356,https://www.pointdaily.co.kr/news/articleView.html?idxno=190356
286,2024-02-13 14:58:00,"SKT 엑스칼리버, 호주 동물병원 300곳서 활용",SK텔레콤은 호주 최대 의료기기 유통기업인 에이티엑스(ATX)와 <b>인공지능</b>(AI) 기반 수의 진단 보조 솔루션인 '엑스칼리버'의 호주 내 유통을 위한 상용 계약을 했다고 13일 밝혔다. 에이티엑스는 보유 중인 클라우드... ,https://www.thereport.co.kr/news/articleView.html?idxno=46426,https://www.thereport.co.kr/news/articleView.html?idxno=46426
287,2024-02-13 14:58:00,에브리봇 주가 파죽지세...업계 첫 AI 서빙로봇 상용화 나서,업계 처음으로 AI(<b>인공지능</b>)서빙로봇 상용화에 나서면서 실적개선 기대감이 주가를 끌어 올리고 있는 것으로 풀이된다. 에브리봇은 제스처 인식 AI 기반 로봇 제어 방법 관련 특허 2건을 출원했다. 회사 측에 따르면... ,https://www.pinpointnews.co.kr/news/articleView.html?idxno=245254,https://www.pinpointnews.co.kr/news/articleView.html?idxno=245254
288,2024-02-13 14:58:00,"파미셀, 작년 당기순익 37억원...5년 연속 흑자 기록","&quot;라며 &quot;또한, 최근에는 AI(<b>인공지능</b>) 관련 저유전율소재 및 광학용 소재와 같은 첨단소재 분야에서 신규 수요가 급증해 파미셀의 성장을 견인할 것&quot;이라고 말했다. 이어 &quot;최근 첨단재생바이오법 개정으로... ",https://www.newspim.com/news/view/20240213000914,https://www.newspim.com/news/view/20240213000914
289,2024-02-13 14:58:00,&quot;민원실 살균·정화&quot; 천안시청에 AI 방역 로봇 떴다,충남 천안시가 시청 민원실에 <b>인공지능</b>(AI) 방역로봇을 설치했다고 13일 밝혔다. 시에 따르면 <b>인공지능</b>(AI) 방역로봇은 카메라와 센서를 활용해 사물을 인지하고 민원실 공간을 자율주행하며 공기정화와 바닥을 살균한다.... ,http://www.newsis.com/view/?id=NISX20240213_0002624869&cID=10807&pID=10800,https://n.news.naver.com/mnews/article/003/0012370394?sid=102
290,2024-02-13 14:58:00,"“광주, AI 반도체 패키징 산업 육성 최적지”…광주테크노파크, 세미나 개최","광주테크노파크는 지난 6일 최기영 전 과학기술정보통신부 장관과 성경륭 초대 국가균형발전위원장 등과 함께 국가<b>인공지능</b>(AI)데이터센터 방문, 광주AI산업 추진현황을 살폈다고 13일 밝혔다. 이어 이병택 광주시... ",https://www.etnews.com/20240213000246,https://n.news.naver.com/mnews/article/030/0003180555?sid=102
291,2024-02-13 14:56:00,"광주테크노파크, 광주 반도체산업 활성화 위한 세미나",광주<b>인공지능</b>사업 추진현황을 살펴보고 광주테크노파크에서 지역 반도체 AI 에너지전문가들과 세미나를 가졌다고 13일 밝혔다. 이번 세미나는 김영집 광주테크노파크 원장과 최기영 전 과학기술정보통신부 장관... ,http://www.namdonews.com/news/articleView.html?idxno=758454,http://www.namdonews.com/news/articleView.html?idxno=758454
292,2024-02-13 14:56:00,세무조사 '역대 최저' 1만4천건이하로…128만 영세사업자 부가세 납기연장,장애인 보장구 구입비(장애인) 등 특정계층을 위한 맞춤형 자료를 제공하는 등 연말정산 서비스도 지속해서 개선한다. 생성형 <b>인공지능</b>(AI) 상담을 5월 종합소득세 신고때 시범 도입하는 등 국세상담도 고도화할 방침이다.,http://www.seouleconews.com/news/articleView.html?idxno=76082,http://www.seouleconews.com/news/articleView.html?idxno=76082
293,2024-02-13 14:56:00,"헌재, 신임 사무처장에 김정원 차장 임명…첫 헌법연구관 출신",헌재는 &quot;향후 신임 사무처장으로서 해당 사업과 <b>인공지능</b>(AI) 도입 계획을 성공적으로 추진해 헌법재판의 효율성을 높이고 국민들에게 더욱 편리한 서비스를 제공하는 데 앞장설 것&quot;이라고 밝혔다. 김 신임 처장의... ,https://www.nocutnews.co.kr/news/6094551,https://n.news.naver.com/mnews/article/079/0003863001?sid=102
294,2024-02-13 14:56:00,"日 후쿠오카현 남부, 반도체 투자 러시… 중소기업도 기회 잡는다","<b>인공지능</b>(AI) 수요 증가로 반도체 시장은 회복세를 보이고 있으며, 2024년 시장 규모는 사상 최대가 될 것이라는 전망도 있다. 제조 장비 생산도 증가할 것으로 예상돼 부품 수주 확대를 노리는 기업들이 늘어나는... ",http://www.g-enews.com/ko-kr/news/article/news_all/202402131452412598e8b8a793f7_1/article.html,http://www.g-enews.com/ko-kr/news/article/news_all/202402131452412598e8b8a793f7_1/article.html
295,2024-02-13 14:54:00,"샤오미, 10만원대 저가형 레드미 워치4 출시",전작보다 향상된 액티브노이즈캔슬링(소음제거)을 통해 배경 소음을 99.5%까지 차단하고 <b>인공지능</b>(AI)을 활용해 초속 6m의 바람 소리까지 없앨 수 있다. 티타늄 진동판을 장착한 초대형 드라이버와 독립적인 사운드... ,http://www.finomy.com/news/articleView.html?idxno=206920,http://www.finomy.com/news/articleView.html?idxno=206920
296,2024-02-13 14:54:00,"KB금융지주, 지난해 4분기 관심도 1위…하나·우리금융지주 순",KB금융은 <b>인공지능</b>과 RPA를 활용해 금융거래 전반에서 이상 징후를 사전에 탐지하는 시스템을 구축했다. KB금융지주에 이어 하나금융지주가 8만9510건의 포스팅 수로 관심도 2위를 차지했다. 지난해 12월... ,http://www.financialreview.co.kr/news/articleView.html?idxno=27385,http://www.financialreview.co.kr/news/articleView.html?idxno=27385
297,2024-02-13 14:54:00,"기업 문제 해결하고, 학점도 따고…'위밋 프로젝트' 시상",우수 팀으로 선정된 광운대-로봇앤드디자인 팀은 최근 미국 반려동물로 새의 인기가 높아지는 현상 등에서 포착해 고성능 <b>인공지능</b>(AI) 기술과 통신 기능을 탑재한 앵무새 모형의 반려로봇 사업화 아이디어를... ,https://news.bbsi.co.kr/news/articleView.html?idxno=3144057,https://news.bbsi.co.kr/news/articleView.html?idxno=3144057
298,2024-02-13 14:54:00,"천안시, <b>인공지능</b> 방역로봇 설치",충남 천안시는 시청 민원실에 <b>인공지능</b>(AI) 방역로봇을 설치했다. [천안시 제공] 충남 천안시는 시청 민원실에 <b>인공지능</b>(AI) 방역로봇을 설치했다고 13일 밝혔다. <b>인공지능</b>(AI) 방역로봇은 카메라와 센서를 활용해 사물을... ,https://www.jeonmae.co.kr/news/articleView.html?idxno=1013969,https://www.jeonmae.co.kr/news/articleView.html?idxno=1013969
