count,date,title,description,org_link,link
498,2024-02-13 13:36:00,'똑똑' <b>인공지능</b> 스피커… 대덕구 어르신 생명 구조,대전 대덕구의 스마트돌봄 사업 <b>인공지능</b>(AI) 스피커가 지역 어르신의 생명을 구했다. 구에 따르면 지난달 한 어르신이 두통을 호소해 AI 스피커에 &quot;살려달라&quot;고 하며 구조를 요청했다. 이에 목소리를 인식한 AI 스피커가... ,http://www.chungnamilbo.co.kr/news/articleView.html?idxno=756661,http://www.chungnamilbo.co.kr/news/articleView.html?idxno=756661
499,2024-02-13 13:34:00,"청송군 치매안심센터, ‘AI 스마트 돌봄서비스 확대’운영",청송군치매안심센터는 <b>인공지능</b>(AI)을 활용한 치매 돌봄 지원사업을 이달부터 30가구로 사업을 확대해 운영한다. (사진=청송군 제공) 경북 청송군치매안심센터는 <b>인공지능</b>(AI)을 활용한 치매 돌봄 지원사업을 이달부터... ,https://www.cnbnews.com/news/article.html?no=643071,https://www.cnbnews.com/news/article.html?no=643071
500,2024-02-13 13:34:00,"AI 반도체 설계 가온칩스, 日 수출 계약에 28%↑",가온칩스가 13일 550여억원 규모 AI(<b>인공지능</b>)용 주문형 반도체 설계 개발 계약을 수주했다고 밝히면서 급등하고 있다. 가온칩스는 코스닥에서 이날 오후 1시29분 전장대비 28.26% 상승한 8만8500원에 거래되고... ,http://news.mt.co.kr/mtview.php?no=2024021313321445851,https://n.news.naver.com/mnews/article/008/0004997904?sid=101
501,2024-02-13 13:34:00,"사이버대 서울디지털대, 16일까지 ‘봄학기 신·편입생' 최종모집",올해 신설한 반려동물전공과 산업안전공학전공 신입생과 3학년편입생 모집에 높은 관심을 받았으며 미래 산업의 핵심인 <b>인공지능</b> AI 전문가 양성을 위해 IT공학부를 기계로봇항공학부로 분화 개편하고 기존의... ,https://www.asiatime.co.kr/article/20240213500223,https://www.asiatime.co.kr/article/20240213500223
502,2024-02-13 13:34:00,2월 대한민국 엔지니어상에 삼성전자 이호원·대영아이오티 모형규,그는 <b>인공지능</b>(AI) 기술을 활용한 주차 관제 시스템과 위치 조정기능을 갖춘 스마트 무인정산기를 개발해 차세대 주차 플랫폼에 기여한 공로를 인정받았다. 그가 개발한 주차관제시스템은 차량번호 인식률을 99... ,https://www.etoday.co.kr/news/view/2330386,https://www.etoday.co.kr/news/view/2330386
503,2024-02-13 13:34:00,"MS-북경대 연구팀, 안드로이드에서 챗GPT 자율 조작 가능케 하는 방법 찾았다",챗GPT [사진: 셔터스톡] 마이크로소프트 리서치와 중국 베이징대학교 연구진이 <b>인공지능</b>(AI) 대규모 언어 모델(LLM)이 운영체제(OS) 내에서 자율적으로 작동하도록 하는 방법을 발견했다. 12일(현지시간) 블록체인... ,https://www.digitaltoday.co.kr/news/articleView.html?idxno=505668,https://www.digitaltoday.co.kr/news/articleView.html?idxno=505668
504,2024-02-13 13:32:00,"&quot;올해 AI PC∙스마트폰 출하, 2억9500만대 육박&quot;",[자료=가트너] 시장조사기관 가트너(Gartner)가 2023년 2900만대였던 전세계 <b>인공지능</b>(AI) 탑재 PC 및 생성형AI 탑재 스마트폰 출하량이 2024년 말까지 총 2억9500만대에 이를 것이라는 전망을 발표했다. AI PC란... ,http://www.koit.co.kr/news/articleView.html?idxno=120474,http://www.koit.co.kr/news/articleView.html?idxno=120474
505,2024-02-13 13:32:00,"[특징주] 링크제니시스, AI 가속기 2배 공급 확대 전망… NPU 특허·삼성전자...",<b>인공지능</b>(AI) 가속기 종류 중 하나인 신경망처리장치(NPU) 수요가 올해 2배가량 급증할 것이라는 전망에 관련 특허 보유 및 삼성전자를 주고객사로 두고 있는 링크제니시스 주가가 강세다. 13일 오후 1시26분 기준... ,https://www.moneys.co.kr/article/2024021313293854623,https://n.news.naver.com/mnews/article/417/0000981272?sid=101
506,2024-02-13 13:32:00,다쏘시스템 '3D익스피리언스 월드 2024' 개최,"통해 <b>인공지능</b>과 디지털 트랜스포메이션부터 협업 혁신, 버추얼 트윈에 이르기까지 설계 및 제조에 관한 최신 주제들을 공유하고 전략을 논의할 예정이다. 295개의 워크숍 및 기술 교육 세션과 설계, 시뮬레이션... ",http://www.koit.co.kr/news/articleView.html?idxno=120478,http://www.koit.co.kr/news/articleView.html?idxno=120478
507,2024-02-13 13:32:00,"인천시, 재활용품 현금 보상 '자원순환가게' 99개소로 확대","특히, 올해는 시비 4억 4000만 원을 지원해 4개 구에 <b>인공지능</b>(AI) 기반의 무인회수기 22대를 설치해 식품 용기, 의류, 신발, 가방 등을 만들 수 있는 투명 페트병을 집중수거할 계획이다. 김철수 시 환경국장은 “2026년... ",http://www.g-enews.com/ko-kr/news/article/news_all/20240213130013494514e0091f6_1/article.html,http://www.g-enews.com/ko-kr/news/article/news_all/20240213130013494514e0091f6_1/article.html
508,2024-02-13 13:32:00,"‘역대급 매출’ 달성 KAI, 1000억원 규모 미래사업 투자 본격화","KAI는 이번 투자를 통해 무인전투기 개발을 위한 개념연구과 자율비행 실증, <b>인공지능</b> 파일럿(AI Pilot) 편대운용 제어 및 고성능 데이터링크 통합 기술 등 유무인 복합체계의 기술을 확보한다는 계획이다. 이를... ",https://www.smartfn.co.kr/article/view/sfn202402130039,https://www.smartfn.co.kr/article/view/sfn202402130039
509,2024-02-13 13:32:00,김창기 국세청장 “AI 기반 <b>지능</b>형 홈택스 5월부터 시범 도입”,국세청이 올해 <b>인공지능</b>(AI) 검색 기반 <b>지능</b>형 홈택스를 구현한다. 납세자 질문에 맞는 답변을 알아서 제공하는 '생성형 AI 상담'을 5월 종합소득세 신고부터 시범 도입한다. 클릭 한 번으로 해결되는 비대면 납세서비스로... ,https://www.etnews.com/20240213000165,https://n.news.naver.com/mnews/article/030/0003180480?sid=101
510,2024-02-13 13:31:00,"국세청, 올해도 中企 세무조사 자제…불법사채·주가조작은 엄단",국세청은 <b>인공지능</b>(AI) 검색 도입 등을 통해 <b>지능</b>형 홈택스 구현에도 박차를 가할 계획이다. 우선 디지털 ARS 국세 상담의 상담 분야 및 운영시간을 종전 8시간에서 24시간으로 확대한다. 누적된 상담 데이터와 세법을... ,https://www.hankyung.com/article/202402139909i,https://n.news.naver.com/mnews/article/015/0004947696?sid=101
511,2024-02-13 13:30:00,"이재용 '담대한 투자' 강조…삼성, 올해 역대급 투자 이어질까",최근 오픈AI의 샘 올트먼 최고경영자(CEO)가 <b>인공지능</b>(AI) 반도체 제조를 위해 최대 7조 달러(약 9300억원) 자금 조달을 추진하고 있는 점도 삼성전자의 차세대 메모리 투자 심리를 자극할 것으로 보인다. 업계 관계자는... ,http://www.newsis.com/view/?id=NISX20240213_0002624557&cID=10414&pID=13000,https://n.news.naver.com/mnews/article/003/0012370087?sid=101
512,2024-02-13 13:30:00,"루닛, 유럽영상의학회서 연구 초록 5편 공개",루닛 인사이트 CXR와 루닛 인사이트 MMG / 사진=루닛 의료 <b>인공지능</b>(AI) 개발기업 루닛(대표 서범석)은 오는 28일부터 다음달 3일까지 오스트리아 빈에서 개최되는 '2024 유럽영상의학회(European Congress of Radiology... ,http://www.hitnews.co.kr/news/articleView.html?idxno=52238,http://www.hitnews.co.kr/news/articleView.html?idxno=52238
513,2024-02-13 13:30:00,'시총 3조달러' 다시 태어난 거인 MS ··· '나델라 10년 매직' 통했다,MS를 <b>인공지능</b>(AI) 혁명을 주도하는 기업으로 탈바꿈시킨 것은 가장 빛나는 업적이다. 챗GPT 열풍을 불러일으킨 비영리 스타트업 오픈AI와의 제휴가 신의 한 수로 꼽힌다. MS는 지난 5년간 오픈AI에 130억달러를 투자해... ,https://www.econovill.com/news/articleView.html?idxno=645500,https://www.econovill.com/news/articleView.html?idxno=645500
514,2024-02-13 13:29:00,"군산대-獨아헨공대, 진로탐색학점제 프로그램 운영","이번 프로그램에 조한규 컴퓨터소프트웨어학부 <b>인공지능</b>융합전공 교수와 재학생 4명이 참여했다. 이들은 MRI 하이퍼스캐닝, 7T MRI, EEG-fMRI 동시 측정 장비 등 최신 뇌과학 실험실을 견학하고 <b>인공지능</b> 기반... ",http://news.mt.co.kr/mtview.php?no=2024021312040134506,https://n.news.naver.com/mnews/article/008/0004997899?sid=102
515,2024-02-13 13:29:00,"[3D익스피리언스월드 2024] 25년 맞은 3D익스피리언스월드, &quot;이제 확장의 단계...","또한, 가상 현실(VR), <b>인공 지능</b>(AI), 지속 가능한 설계와 같은 최신 기술 동향에 대한 세션을 포함하며 기술의 미래 방향에 대한 통찰력을 제공하고 있기도 하다. 다쏘시스템이 11일(현지 시각)부터 14일까지 미국... ",https://www.ddaily.co.kr/page/view/2024021307311313662,https://n.news.naver.com/mnews/article/138/0002166714?sid=105
516,2024-02-13 13:28:00,"천안시, 시청 민원실에 <b>인공지능</b> 방역로봇 설치",천안시가 방문 민원인의 안전과 쾌적한 민원실 환경 조성을 위해 시청 민원실에 <b>인공지능</b>(AI) 방역로봇을 설치했다고 13일 밝혔다. <b>인공지능</b>(AI) 방역로봇은 카메라와 센서를 활용해 사물을 인지해 스스로 민원실 공간을... ,http://www.bzeronews.com/news/articleView.html?idxno=646380,http://www.bzeronews.com/news/articleView.html?idxno=646380
517,2024-02-13 13:26:00,반도체 시장을 선도한다! 웨이퍼 테스트용 세라믹 기판,"들어가는 필수 부품이 바로 세라믹 기판이다. 특히 <b>인공지능</b>, 슈퍼컴퓨팅에 사용되는 HBM급 메모리! 이를 평가하는 프로브카드용 세라믹 기판은 고도의 기술이 필요하는데, 최강기업의 기술을 지금부터 만나본다!",https://science.ytn.co.kr/program/view.php?mcd=1587&hcd=&key=202402131318137685,https://science.ytn.co.kr/program/view.php?mcd=1587&hcd=&key=202402131318137685
518,2024-02-13 13:26:00,"“AI가 만능통장 관리”…하나은행, '일임형 ISA' 가입 이벤트","은행권 최초로 일임형 ISA 상품에 AI(<b>인공지능</b>) 기술을 도입한 것을 기념한 이벤트다. ISA(개인종합자산관리계좌)는 하나의 계좌로 예·적금, 펀드 등 다양한 금융상품을 운용하면서 절세혜택도 받을 수 있는 상품으로... ",https://biz.newdaily.co.kr/site/data/html/2024/02/13/2024021300174.html,https://biz.newdaily.co.kr/site/data/html/2024/02/13/2024021300174.html
519,2024-02-13 13:26:00,"SK텔레콤 AI 수의진단 '엑스칼리버', 호주 동물병원 진입 시동",SK텔레콤(대표 유영상)의 AI(<b>인공지능</b>) 기반 수의 진단 보조 솔루션인 '엑스칼리버(X Caliber)'가 올 상반기 중으로 호주 동물병원에서 활용될 전망이다. SK텔레콤은 호주 최대 의료기기 유통기업인 에이티엑스(ATX... ,https://www.upinews.kr/newsView/1065585929150993,https://www.upinews.kr/newsView/1065585929150993
520,2024-02-13 13:25:00,"스포키, 국내 핸드볼 활성화 ‘H리그’ 생중계…다양한 스포츠 서비스로 ‘찐...",이 밖에도 자체 개발한 <b>인공지능</b>(AI) 기술 등을 활용해 스포키 고도화를 추진할 방침이다. 앞서 스포키는 익시 기반의 비전 AI 기술을 활용해 스포츠 경기 하이라이트 영상을 실시간 제작한 ‘AI 하이라이트’ 서비스를... ,https://www.sportsseoul.com/news/read/1398565?ref=naver,https://n.news.naver.com/mnews/article/468/0001029932?sid=101
521,2024-02-13 13:24:00,[양재찬 칼럼]정책 공약의 ‘유효슈팅’ 전술,"기후위기에 대응하는 탄소중립 및 신재생에너지 전환, 글로벌 공급망 재편, 반도체 전쟁, <b>인공지능</b>(AI) 기술 경쟁 등에서 뒤처지면 따라잡기 힘들어진다. 여든 야든 여의도를 향해 뻥뻥 질러댄다고 골로 연결되지 않는다.... ",https://www.naeil.com/news/read/500995?ref=naver,https://www.naeil.com/news/read/500995?ref=naver
522,2024-02-13 13:24:00,"[주간투자동향] 클라우드호스피탈, 20억 원 규모 프리 시리즈A 투자 유치","라이언로켓, 브릿지 투자 유치 웹툰 생성형 AI(<b>인공지능</b>)를 제공하는 라이언로켓이 CJ인베스트먼트로부터 투자를 유치했다. 지난해 12월 60억 원 브릿지 투자 유치에 이은 후속 성과다. 라이언로켓은 독자적인 캐릭터 고정... ",https://it.donga.com/104955/,https://it.donga.com/104955/
523,2024-02-13 13:23:00,"스트라드비젼, 최고사업책임자에 테슬라 출신 필립 비달 선임",<b>인공지능</b>(AI) 기반 영상 인식 소프트웨어 개발 스타트업인 스트라드비젼이 신임 최고사업책임자(CBO)에 필립 비달(Philip Vidal)을 선임했다고 13일 밝혔다. 비달 CBO는 자율주행 분야에서 사업 개발 능력을 쌓아 온 만큼... ,https://www.sedaily.com/NewsView/2D5CF5D3EZ,https://n.news.naver.com/mnews/article/011/0004298848?sid=101
524,2024-02-13 13:22:00,"이형석 국회의원, 22대 총선 출마 선언…尹정권 심판, 역사퇴행저지","이어 “개장 30년이 지나 시설이 낡은 패밀리랜드를 최첨단 복합 테마파크로 업그레이드 시키고, ‘아시아 캐릭터랜드’를 새롭게 조성하는 한편, <b>인공지능</b> 집적화단지 2단계 추진으로 ‘AI 중심도시 북구’를... ",https://www.wikitree.co.kr/articles/926607,https://www.wikitree.co.kr/articles/926607
525,2024-02-13 13:21:00,"육군, ROTC 선발 필기시험 15년 만에 폐지",이후 실시되는 면접평가도 대면 면접 방식에서 <b>인공지능</b>(AI) 온라인 면접과 대면 면접을 혼합하는 방식으로 전환한다. AI면접에서는 확고한 윤리의식과 회복탄력성 등 9개 요소를 평가한다. 대면면접에서는... ,https://www.sedaily.com/NewsView/2D5CFAEW71,https://n.news.naver.com/mnews/article/011/0004298847?sid=100
526,2024-02-13 13:20:00,"관세청, 올해 AI 등 신기술 도입 전 분야서 스마트 혁신","관세청이 올해 <b>인공지능</b>(AI) 등 신기술을 도입, 전 분야에 대한 신속하고 끊임없는 스마트 혁신에 나선다. 사회안전 및 국가 번영, 글로벌 무역 스탠다드 선도 등을 3대 목표로 불법위해물품 반입 차단 등 5대 핵심과제를... ",http://www.edaily.co.kr/news/newspath.asp?newsid=02620726638790192,https://n.news.naver.com/mnews/article/018/0005672211?sid=101
527,2024-02-13 13:20:00,"국세청, AI 상담 시범도입…올해 세무조사 1.4만건 이하로",국세청이 비대면 납세서비스 강화를 위해 <b>인공지능</b> 적용 상담 서비스를 시범 도입합니다. 국세청은 이 같은 내용을 담은 2024년 주요정책 추진계획(국세행정 운영방안)을 발표했다고 오늘(13일) 밝혔습니다. 추진계획에... ,https://biz.sbs.co.kr/article_hub/20000156766?division=NAVER,https://n.news.naver.com/mnews/article/374/0000370261?sid=101
528,2024-02-13 13:19:00,반도체·바이오株 상승에 코스피 1%대 강세 [오후 시황],"반도체, 바이오 업종 등 <b>인공지능</b>(AI) 수혜주에 매수세가 몰리면서 코스피가 1%대 강세다. 13일 오후 1시 3분 기준 코스피 지수는 전 거래일보다 28.71포인트(1.10%) 오른 2647.77이다. 지수는 전 거래일보다 23.... ",https://www.sedaily.com/NewsView/2D5CF5C7SV,https://n.news.naver.com/mnews/article/011/0004298845?sid=101
529,2024-02-13 13:19:00,홈택스에 <b>인공지능</b> 도입…소상공인에 세정지원도,"국세청이 운영하는 납세 자동화 온라인 서비스인 홈택스에 <b>인공지능</b>이 도입됩니다. 국세청은 최근 이같은 내용과 함께 비대면 납세 서비스 강화, 소상공인 세정지원 등을 담은 올해 주요 추진계획을 밝혔습니다. 국세청은... ",https://news.jtbc.co.kr/article/article.aspx?news_id=NB12165084,https://n.news.naver.com/mnews/article/437/0000379413?sid=101
530,2024-02-13 13:18:00,"미래에셋증권, '투자하는 연금'으로 DC·IRP중장기 수익률 1위","운용하기 위해서는 투자와 관리가 병행되어야 한다&quot;며 &quot;미래에셋증권은 사내 의사결정기구를 통해 우수한 상품을 선정하고, 전문인력과 <b>인공지능</b>(AI) 기술을 통해 글로벌 포트폴리오를 제공하고 있다&quot;고 말했다.",http://www.metroseoul.co.kr/article/20240213500294,http://www.metroseoul.co.kr/article/20240213500294
531,2024-02-13 13:18:00,홍릉에 '기술융합 차세대 K-콘텐츠' 체험하러 오세요,△3D 애니메이션 '호문클루스'의 1987 △단편영화 '지붕 위의 질투'의 50그램 △<b>인공지능</b> 음악영화 &lt;삭제된 세계&gt;의 아티피셜 스피릿(Artificial Spirit) △버추얼 콘서트 플랫폼 ‘머스터(MVSTER)’를 제작한 엠앤유(MandU)... ,http://www.fnnews.com/news/202402131300203146,https://n.news.naver.com/mnews/article/014/0005141421?sid=103
532,2024-02-13 13:18:00,"수원시, 2024 청소년 육성 보조사업자 모집","‘청소년 디지털 역량 제고를 위한 프로그램청소년 디지털 역량 강화 프로그램 - 코딩, VR(가상현실)·AR(증강현실), <b>인공지능</b> 기초, 데이터 과학, 디지털 저작권 교육 등’에 지원하는 단체·기관에는 가점이 부여된다.... ",https://www.nspna.com/news/?mode=view&newsid=682364,https://www.nspna.com/news/?mode=view&newsid=682364
533,2024-02-13 13:17:00,"온라인 식품 거래액, 지난해 사상 첫 40조원 돌파 '일상화'",롯데쇼핑은 영국 리테일 테크 기업 오카도와 손잡고 부산에 최첨단 물류센터를 짓는 등 2030년까지 1조원을 투자해 <b>인공지능</b>(AI)에 기반한 최첨단 물류센터를 전국에 6개 건립할 예정이다. 또 홈페이지와... ,http://sports.chosun.com/news/ntype.htm?id=202402130100082730010993&servicedate=20240213,https://n.news.naver.com/mnews/article/076/0004109486?sid=101
534,2024-02-13 13:15:00,"&quot;<b>인공지능</b>은 민감정보 파수꾼&quot;···파수, 'AI바우처' 수요기업 모집",파수가 '2024 AI바우처 지원사업'의 공급기업으로 선정돼 해당 사업의 수요기업을 모집한다. 파수에 따르면 'AI바우처 지원사업'은 과학기술정보통신부와 정보통신산업진흥원(NIPA)이 AI 의 도입과 확산을 지원하기... ,http://www.enewstoday.co.kr/news/articleView.html?idxno=2089388,http://www.enewstoday.co.kr/news/articleView.html?idxno=2089388
535,2024-02-13 13:14:00,[WIKI INSIDE] 공공기관 사칭 보이스피싱 고도화…AI가 스마트폰 악성URL·앱...,LG유플러스 측은 &quot;공공시스템 '한국인터넷진흥원(KISA)의 스팸종합모니터링'의 신고내용과 '경찰청 신고 데이터(스미싱 URL·보이스피싱 번호·스팸번호 등)을 모아 <b>인공지능</b>(AI)과 머신러닝 등 ICT 기술로 피해상황을... ,http://www.wikileaks-kr.org/news/articleView.html?idxno=149245,http://www.wikileaks-kr.org/news/articleView.html?idxno=149245
536,2024-02-13 13:14:00,"SKT '엑스칼리버', 상반기내 호주 동물병원서 활용",하민용 SKT CDO(사진 왼쪽)와 로저 데이비스(Roger Davis) 에이티엑스 창업자 겸 디렉터가 유통 계약 체결 후 기념사진을 찍고 있다.ㅣSKT SK텔레콤이 개발한 <b>인공지능</b>(AI)을 활용한 수의학 진단 보조 솔루션이 호주... ,http://www.biztribune.co.kr/news/articleView.html?idxno=304255,http://www.biztribune.co.kr/news/articleView.html?idxno=304255
537,2024-02-13 13:14:00,"LG전자, 영화감독·색상전문가 LG 올레드 TV 호평",<b>인공지능</b> 음향 기술은 2채널 음원을 이제 가상의 11.1.2채널까지 변환해 풍성한 음향을 구현한다. LG전자 오혜원 HE브랜드커뮤니케이션담당은 &quot;LG 올레드 TV는 전용 AI 화질·음질 칩을 기반으로 영화감독·컬러리스트 등... ,https://www.thefairnews.co.kr/news/articleView.html?idxno=22230,https://www.thefairnews.co.kr/news/articleView.html?idxno=22230
538,2024-02-13 13:14:00,"글로벌 빅테크·자동차 기업, 자율주행 상용화 늦는 이유",결국 현재 자율주행차의 안전 문제를 해소하는 가장 확실한 방법으로 더욱 다양하고 풍부한 주행 데이터 확보와 그로 인한 자율주행 <b>인공지능</b>(AI)의 고도화가 꼽힌다. 즉 상용화를 뒤로 미룰 만한 충분한 시간이 답인... ,http://www.g-enews.com/ko-kr/news/article/news_all/202402081120119483b418061615_1/article.html,http://www.g-enews.com/ko-kr/news/article/news_all/202402081120119483b418061615_1/article.html
539,2024-02-13 13:12:00,무료로 개설되는 40개 강좌…서울시민대학 수강생 모집,"동남권 캠퍼스에는 최신 <b>인공지능</b>(AI) 기술 소개부터 AI를 활용하는 ‘뤼튼(wrtn)’, ‘릴리스에이아이(Lilys AI)’ 같은 서비스가 우리 생활을 어떻게 변화시키는지를 실습해보는 강좌가 마련된다. 미래사회 변화를... ",https://www.sedaily.com/NewsView/2D5CES1IX5,https://n.news.naver.com/mnews/article/011/0004298841?sid=101
540,2024-02-13 13:12:00,미래에셋증권 &quot;DC·IRP 중장기 수익률 1위&quot;,미래에셋증권 관계자는 &quot;연금을 우수한 수익률로 장기간 안정적으로 운용하기 위해서는 투자와 관리가 병행돼야 한다&quot;며 &quot;미래에셋증권은 사내 의사결정기구를 통해 우수한 상품을 선정하고 전문인력과 <b>인공지능</b>... ,http://www.smedaily.co.kr/news/articleView.html?idxno=281493,http://www.smedaily.co.kr/news/articleView.html?idxno=281493
541,2024-02-13 13:12:00,전기차 이어 자율주행차 시장도 중국이 선점 노린다,"구글이나 테슬라 등 서방권 기업들이 추진 중인 자율주행 기술은 대부분 외부 도움 없이 차량 자체의 센서로 획득한 데이터와 내장 <b>인공지능</b>(AI) 컴퓨터에만 의지해 자율주행을 구현하는 방식이다. 반면, 중국은 차량... ",http://www.g-enews.com/ko-kr/news/article/news_all/202402081606544192b418061615_1/article.html,http://www.g-enews.com/ko-kr/news/article/news_all/202402081606544192b418061615_1/article.html
542,2024-02-13 13:10:00,"부호·이름·전화번호 모두 일치해야 통관 가능...관세청, 개인통관부호 검증...","<b>인공지능</b>(AI) 우범화물 선별모델 확대와 엑스레이(X-ray)판독시스템 고도화, 우범여행자추적 AI CCTV 구축 등 신기술 기반 감시 인프라를 강화한다. 또한 마약 밀수가 많이 적발되는 우범 항공편에 대해서는 여행자 일제... ",https://www.ajunews.com/view/20240213130532999,https://www.ajunews.com/view/20240213130532999
543,2024-02-13 13:10:00,"송미령 장관, 충남 논산 소재 <b>지능</b>형농장(스마트팜) 솔루션 도입 농가 현장방...","송 장관은 농업 인구감소, 기후변화 등 농업 현장에 닥친 문제에 대응하여 세계적으로 스마트농업에 대한 관심이 고조되고 있음을 강조하면서, “<b>인공지능</b>(AI)·빅데이터를 활용한 <b>지능</b>형농장(스마트팜) 솔루션의 보급은... ",http://www.newsam.co.kr/news/article.html?no=37160,http://www.newsam.co.kr/news/article.html?no=37160
544,2024-02-13 13:10:00,"[특징주]세코닉스, 美중국산 스마트카 부품 제한 검토..엔비디아와 자율주행카...","최근 자율주행차에 쓰이는 카메라 렌즈 기술 개발에 나섰고 <b>인공지능</b>(AI), 자율주행차 소프트웨어 기업인 엔비디아(NVIDIA)와 함께 자율주행 카메라를 개발하는 등 차세대 성장동력 확보도 순항 중이다.",http://www.fnnews.com/news/202402131059516702,https://n.news.naver.com/mnews/article/014/0005141419?sid=101
545,2024-02-13 13:10:00,"SK하이닉스, 엔비디아 상승세 지속에 주가 '싱글벙글'","이와함께 SK하이닉스가 TSMC와 맺은 <b>인공지능</b>(AI) 동맹에 대한 투자자들의 기대감도 상승 요인으로 든다. SK하이닉스는 1983년 현대전자로 설립, 2001년 하이닉스반도체를 거쳐 2012년 최대주주가 SK텔레콤으로... ",https://www.cwn.kr/news/articleView.html?idxno=26432,https://www.cwn.kr/news/articleView.html?idxno=26432
546,2024-02-13 13:08:00,"인천 서구도서관, <b>인공지능</b> 활용 동화책 만들기 강좌 운영","인천 서구도서관은 초등 3~6학년을 대상으로 <b>인공지능</b>(AI)를 활용해 글을 쓰고, 그림을 그려 동화책을 만드는 ‘<b>인공지능</b>(AI) 동화책 작가탄생’ 강좌를 3월8일부터 5회 운영한다고 13일 전했다. 프로그램은 <b>인공지능</b> 도구를... ",http://www.shinailbo.co.kr/news/articleView.html?idxno=1827931,http://www.shinailbo.co.kr/news/articleView.html?idxno=1827931
547,2024-02-13 13:06:00,이젠 '대한민국 대표 AI실증도시' 광주로 거듭난다,"<b>인공지능</b> 중심 산업융합 집적단지 조감도.&quot;광주는 대한민국에서 AI와 관련된 기술, 인프라, 인재 등 모든 역량을 갖춘 유일한 곳입니다. 이제는 도시 전체를 'AI 테스트베드'로 내어드리겠습니다.&quot; 민선 8기 강기정... ",http://www.mdilbo.com/detail/0kIA7d/712598,http://www.mdilbo.com/detail/0kIA7d/712598
